role,experience_type,text
hr,experienced,"HR PARTNER
Summary
Experienced Human Resources Business Partner with expertise in partnering with Line of Business Leaders to provide guidance on human capital
strategies to include, but not limited to, employee relations, talent management, compensation, etc., in order meet business goals and objectives.
Highlights
Project management
Matrix management experience
Talent management expertise
Employee relations expertise
Performance management strategies
Compensation experience
Employment law knowledge
Manager coaching and training
Presentation/Facilitation experience
Accomplishments
Lead Project Teams to address human capital strategies (i.e., Performance Management, Rewards and Recognition, etc.) that resulted in manager
tools and resources.
Developed and facilitated Change Management training for all front-line managers in the Line of Business.
Developed, trained, and implemented common attendance guidelines for line of business and executed to the new guidelines.
Experience
HR Partner 
June 2007 to Current Company Name ï¼​ City , State
Provide strategic human resources guidance and oversight on a wide range of activities in support of assigned line of business. In both a
hierarchical and matrix management environment
Collaborate with senior leadership teams to influence organizational design, management practices and work environment changes.
Lead project teams on end-to-end strategy on human capital initiatives (i.e., retention, rewards and recognition, performance management,
etc.)
Problem-solve mid-complex issues as they arise with all levels of management across business groups.
Coach and develop less experienced staff on broad human resources issues and monitor resolution progress.
Coach and develop managers at all levels on performance management of their employees.
Provide expertise in facilitating resolution of complex issues and interpretation of policies.
Partner with all levels of management in both a hierarchical and matrix management environment to build leadership competencies in order to
build bench-strength through talent management discussions.
Partner and engage with key stakeholders in the Wells Fargo/Wachovia Bank integration efforts.
Develop business cases for Senior Leadership (i.e., LOB, HR, etc.) approval to implement restructure to any one business unit which may
result in displacements.
Partner with LOB Project Team to develop and execute plans and communications in support of these activities.
Lead cross-functional or cross-business unit/division teams assigned to implement workforce initiatives as well as develop programs and
process improvements associated with human capital and business initiatives.
Create and facilitate virtual presentations for employees and managers across several states and four different time zones in the areas of
policy interpretation, recruiting, compensation tools, leaves of absence, etc.
Provide consultation to senior management on complex issues and actions and partner with other human resources partners or COE's (i.e.,
Employee Relations, Compensation, EAC, Leave Management) as needed
Advise managers on compensation issues, review job descriptions, make salary recommendations as needed.
Associate People Svcs Officer 
November 2001 to May 2007 Company Name ï¼​ City , State
Provide strategic human resources guidance and oversight on a wide range of activities in support of assigned line of business.
Coach and develop managers at all levels on performance management of their employees.
Provide expertise in facilitating resolution of complex issues and interpretation of policies.
Create and facilitate virtual presentations for employees and managers across several states and four different time zones in the areas of
policy interpretation, recruiting, compensation tools, leaves of absence, etc.
Provide consultation to senior management on complex issues and actions and partner with other human resources partners or COE's (i.e.,
Employee Relations, Compensation, EAC, Leave Management) as needed
Advise managers on compensation issues, review job descriptions, make salary recommendations as needed.
Provide interpretation, application, and enforcement of HR related policies, procedures, and laws, including but not limited to FMLA, ADA
of 1990, Title VII of the Civil Rights Act of 1964, ADEA of 1967
Conduct interviews and counseling sessions with employees and management, including performance counseling, career counseling,
supervisory coaching, and separations (voluntary and involuntary).
Conduct investigations related to harassment, discrimination, etc. and determine appropriate action warranted.
Facilitate dialogue sessions as needed to help employees/managers resolve issues.
Appeal Texas Workforce Commissions claims when appropriate.
Human Resource Consultant 
March 2001 to November 2001 Company Name ï¼​ City , State
Coach and develop managers at all levels on performance management of their employees.
Provide expertise in facilitating resolution of issues and interpretation of policies.
Facilitate virtual presentations for employees and managers.
in the areas of policy interpretation, recruiting, compensation tools, leaves of absence, etc.
Provide consultation to front line management on issues and actions.
Advise managers on compensation issues, review job descriptions, make salary recommendations as needed.
Provide interpretation, application, and enforcement of HR related policies, procedures, and laws, including but not limited to FMLA, ADA
of 1990, Title VII of the Civil Rights Act of 1964, ADEA of 1967
Conduct interviews and counseling sessions with employees and management, including performance counseling, career counseling,
supervisory coaching, and separations (voluntary and involuntary).
Conduct investigations related to harassment, discrimination, etc. and determine appropriate action warranted.
Human Resources Consultant 
September 1999 to May 2001 Company Name ï¼​ City , State
Coach and develop managers at all levels on performance management of their employees.
Provide expertise in facilitating resolution of issues and interpretation of policies.
Facilitate virtual presentations for employees and managers.
in the areas of policy interpretation, recruiting, compensation tools, leaves of absence, etc.
Provide consultation to front line management on issues and actions.
Advise managers on compensation issues, review job descriptions, make salary recommendations as needed.
Provide interpretation, application, and enforcement of HR related policies, procedures, and laws, including but not limited to FMLA, ADA
of 1990, Title VII of the Civil Rights Act of 1964, ADEA of 1967
Conduct interviews and counseling sessions with employees and management, including performance counseling, career counseling,
supervisory coaching, and separations (voluntary and involuntary).
Conduct investigations related to harassment, discrimination, etc. and determine appropriate action warranted.
Human Resources Consultant 
August 1990 to September 1999 Company Name ï¼​ City , State
Roles started out very transactional and then grew into the list below.
Coach and develop managers at all levels on performance management of their employees.
Provide expertise in facilitating resolution of issues and interpretation of policies.
Facilitate virtual presentations for employees and managers.
in the areas of policy interpretation, recruiting, compensation tools, leaves of absence, etc.
Provide consultation to front line management on issues and actions.
Advise managers on compensation issues, review job descriptions, make salary recommendations as needed.
Provide interpretation, application, and enforcement of HR related policies, procedures, and laws, including but not limited to FMLA, ADA
of 1990, Title VII of the Civil Rights Act of 1964, ADEA of 1967
Conduct interviews and counseling sessions with employees and management, including performance counseling, career counseling,
supervisory coaching, and separations (voluntary and involuntary).
Conduct investigations related to harassment, discrimination, etc. and determine appropriate action warranted.
Education
Masters of Arts : Counseling , May, 2004 Webster University ï¼​ City , State , USA
Counseling
Bachelor of Science : Psychology , December, 2001 University of Houston ï¼​ City , State , USA GPA: Dean's List
Psychology Dean's List
Skills
Title VII
ADA
Mid - Senior level Coaching/Consultation
Employee Relations
Partner with Senior management and Function management
HR Policy Interpretation
Presentation/Facilitation
Collaboration/Partnering skills
Relationship Building skills
Additional Information
SPECIAL AWARDS: 2005 USAA's Volunteer of the Year 2006 President's Council on Service and Civic Participation Award
Professional Affiliations
Wells Fargo - Latino Team Member Network - HR Liaison/member
San Antonio Human Resources Management Association
South Texas Children's Bereavement Center Group Facilitator
CYO Sports Team Mom"
hr,experienced,"HR COORDINATOR
Summary
Certified Human Resources Professional with extensive employee relations experience in a full range of functions, as well as success in
simultaneously managing multiple projects.
Highlights
Employee relations
Compensation administration
Personnel records maintenance
New hire orientation
Hiring and retention
Training and development
Compensation/payroll
Staffing and recruiting professional
Off-boarding
Interviewing expertise
Performance management strategies
Benefits administrator
Employment law knowledge
HRIS applications proficient
Employee handbook development
New employee orientations
Human resources audits
Maintains confidentiality
HR policies and procedures expertise
Human resources management
Excellent interpersonal and coaching skills
Certified Professional Human Resource Management
Accomplishments
Revamped the orientation process for all new hires, which was implemented company-wide. Led the Staffing Planning Committee for [Number]
years. Introduced the first passive Open Enrollment process.
Experience
03/2013 - Current
Company Name - City , State HR Coordinator
Manage the recruitment, selection, and staffing process for full time employees.
Manage the employee orientation and onboarding process for full time employees.
Maintain job classification system including job descriptions; defining objectives, responsibilities, salary information and benchmarking.
Develop, administer and manage personnel policies, procedures and programs for the City.
Advise managers, supervisors, and employees on labor contract, employment law, and policies and procedure matters.
Respond to inquiries from managers, supervisors, and employees, investigate complaints, and provide for conflict resolution.
Works with departments regarding employee issues, recommending appropriate actions involving employee performance, behavior,
productivity, etc.
Completes duties related to compensation, benefits, and performance management.
Manage the City's safety and workers' compensation processes.
Serve as Chair on the City's Benefit, Safety, and Wellness committees; provide direction to committees; ensures compliance with mandated
safety training; develop wellness and safety programs to meet strategic goals of the City.
Develop procedures for managing employee leaves of absence and light duty.
Administer leave of absence programs to include FMLA, Salary Continuation, Parenting Leave, Military Leave, etc.
Ensure compliance with employment law and related regulations.
Conduct research; prepare reports and recommendations on complex issues and projects.
Lead special projects related to human resources initiatives, including software and technology implementation, process improvements,
internal training programs, on-boarding process, exit interview process, etc.
11/2012 - 12/2012
Company Name - City , State Independent HR Contractor
Assisted Human Resources on internal employee website mapping project.
Site is used for employee benefits as well as company information.
Assisted Human Resources on internal employee website mapping project.
Site is used by Room & Board sales staff.
04/2005 - 07/2010
Company Name - City , State Human Resource Assistant/ HR Generalist
Screened applicants for internal and external positions, coordinated and prepared interview schedules and information packets, sent offer
letters, and verified paperwork.
Staffed all contractor positions as well as facilitated orientation for all contract employees.
Conducted new hire orientations for all new employees.
Worked with all levels of management on Employee Relations issues.
Conducted exit interviews and processed required termination paperwork and presented common themes to upper management.
Provided training and communication to employees on HR programs, benefits, processes and other employment related issues.
Administered leaves of absence, short term disability, and worker's compensation.
Managed tuition reimbursement program.
11/2003 - 10/2004
Company Name - City , State Receptionist/Administrative Assistant
Maintained the corporate phone list, Equal Employment Opportunity information, bus pass, and stamp inventories in Microsoft Excel;
ordered and approved all office supply orders.
Coordinated with Memorial Blood Centers to promote and recruit for the NRG/ATT Blood Drive within the company.
Maintained security of the workplace by overseeing the security badge process.
Assigned numerous special projects and completed projects upon deadlines.
Education
2012
Keller Graduate School of Management City , State MBA : Human Resource Management Human Resource Management
2002
University of North Dakota City , State B.A : Communications Communications
Skills
benchmarking, benefits, conflict resolution, direction, Employee Relations,Â  , performance management, personnel, policies, processes,
recruitment, research, Safety, staffing, strategic,Â  training programs,"
hr,experienced,"HR GENERALIST
Experience
04/2015 to Current
Provide general administrative support such as preparing correspondence, forms, and reports Scheduling and coordinating staff meetings,
maintaining meeting minutes and notes Generate confidential ad hoc statistical reporting data and documentation regarding turnover, new
hires, birthdays, anniversaries, benefits, and other relevant HR metrics Collect onboarding documentation to ensure benefit enrollment in a
timely manner and follow up with employees to ensure their electronic enrollment has been processed in the HRIS portal Source
documentation to process new hire setups in HR systems, process changes in pay rate, status, and initial/qualifying life event benefit changes
Establish, maintain and audit employee data and files Manually process background checks entries, employment verifications, and other full-
cycle HR related items for onboarding and departures Assist with maintenance updates to the organizational chart Facilitate and assist in
new hire orientation presentations Maintain highest level of confidentiality and data security to protect employee privacy related to employee
relations issues, organizational changes, planning with a strict adherence to privacy and confidentiality per company policy Respond to
various inquiries from internal and external stakeholders, employees, management, and senior leadership team Participate on several
committees to enhance employee engagement, manager training, and creating strategic HR initiatives.
09/2012 to 06/2014
HR Generalist Company Name ï¼​ City , State
08/2008 to 04/2015
HR Staffing Coordinator Company Name ï¼​ City , State
Processed background checks and drug screens on potential candidates.
Schedule interviews for Managers and candidates Meet and greet potential candidates that come for onsite interviews.
Run Bi-weekly reports for the VP of Human Resources Ensure all Empire markets stay in compliance with state and federal posters.
Audit new hire files for 99 different markets Maintain all employee files and ensure confidentiality Maintain different databases such as ADP,
Payforce and Siebel Conduct new hire orientation weekly Manage WOTC Program for all markets Inform all Office managers, HR
Generalist, and HR managers about various procedures to increase job efficiency Answer phone and email inquiries regarding Company
policies and procedures Work with Recruiters on job descriptions to find qualified candidates for open positions Schedule employees for
Sexual Harassment and EEO Basic Supervisor training courses Assist with various projects and meet multiple deadlines Perform general
administrative duties such as filing, faxing, copying, and ordering offices supplies Assist Corporate Recruiters with scheduling and setting up
interviews Assist benefits manager with enrollment for new and current employees Process verification of employment for current and
terminated employees.
08/2008 to 04/2015
Executive Technical Associate Company Name ï¼​ City , State
Assist Directors, Executives, and Senior Managers with scheduling meetings and calendar maintenance, monitoring voicemail and email,
typing correspondence, and expense reports Travel between offices to assist managers with various matters Maintain weekly and monthly
utilization reports for department staff Maintain weekly scheduling and training database within a call center environment for over 100
Customer Advocates Facilitate office-wide access to various systems Assign and reset passwords and handle monthly database updates.
Schedule contractual and appointment time via IEX/Totalview, and monitor IEX to ensure office-wide adherence, conformance and service
level results are received Perform complex and specialized work related to the preparation, processing, and maintenance of payroll
Generate weekly schedules in Totalview and make available for viewing in Agent Webstation Facilitate departmental moves and arrange
new telephone extensions, cubicles, and location of office space Perform general administrative duties such as filing, faxing, copying, and
ordering offices supplies Strengths Familiarity with various HRIS Systems Proficient with Microsoft Office Suite Attention to detail Multi-
tasking, data analysis, and research.
Education and Training
05/2016
MBA : Business Administration Benedictine University Business Administration
Bachelor of Arts : Business Administration Benedictine University Business Administration
Skills
administrative duties, administrative support, ADP, ad, Attention to detail, Basic, benefits, Bi, calendar maintenance, call center, copying, data
analysis, databases, database, documentation, email, employee relations, expense reports, faxing, filing, forms, HRIS, Human Resources, HR,
leadership, notes, meetings, access, Microsoft Office Suite, Office, Multi-tasking, organizational, payroll, policies, posters, presentations, reporting,
research, Scheduling, Siebel, strategic, Supervisor, telephone, phone, typing"
hr,experienced,"HR SPECIALIST, US HR OPERATIONS
Summary
Versatile media professional with background in Communications, Marketing, Human Resources and Technology.Â 
Experience
09/2015 to Current
HR Specialist, US HR Operations Company Name ï¼​ City , State
Managed communication regarding launch of Operations group, policy changes and system outages
Designed standard work and job aids to create comprehensive training program for new employees and contractors
Audited job postings for old, pending, on-hold and draft positions.
Audited union hourly, non-union hourly and salary background checks and drug screens
Conducted monthly new hire benefits briefing to new employees across all business units
Served as a link between HR Managers and vendors by handling questions and resolving system-related issues
Provide real-time process improvement feedback on key metrics and initiatives
Successfully re-branded US HR Operations SharePoint site
Business Unit project manager for RFI/RFP on Background Check and Drug Screen vendor
01/2014 to 05/2015
IT, Marketing and Communications Co-op Company Name ï¼​ City , State
Posted new articles, changes and updates to corporate SharePoint site including graphics and visual communications.
Researched and drafted articles and feature stories to promote company activities and programs.
Co-edited and developed content for quarterly published newsletter.
Provided communication support for internal and external events.
Collaborated with Communication team, media professionals and vendors to determine program needs for print materials, web design and
digital communications.
Entrusted to lead product, service and software launches for Digital Asset Management tool, Marketing Toolkit website and Executive
Tradeshows Calendar.
Created presentations for management and executive approval to ensure alignment with corporate guidelines and branding.
Maintained the MySikorsky SharePoint site and provided timely solutions to mitigate issues.Â Â Â Â 
Created story board and produced video for annual IT All Hands meeting.
10/2012 to 01/2014
Relationship Coordinator/Marketing Specialist Company Name ï¼​ City , State
Partnered with vendor to manage the in-house advertising program consisting of print and media collateral pieces.
Coordinated pre-show and post-show activities at trade shows.
Managed marketing campaigns to generate new business and to support partner and sales teams.
Ordered marketing collateral for meetings, trade shows and advisors.
Improved, administered and modified marketing programs to increase product awareness.
Assisted in preparing internal promotional publications, managed marketing material inventory and supervised distribution of publications to
ensure high quality product output.
Coordinated marketing materials including brochures, promotional materials and products.
Partnered with graphic designers to develop appropriate materials and branding for brochures.
Used tracking and reporting systems for sales leads and appointments.
09/2009 to 10/2012
Assistant Head Teller Company Name ï¼​ City , State
Received an internal audit score of 100 %.
Performed daily and monthly audits of ATM machines and tellers.
Educated customers on a variety of retail products and available credit options.
Consistently met or exceeded quarterly sales goals
Promoted products and services to customers while maintaining company brand identity Â·Â Â Â Â 
Implemented programs to achieve and exceed customer and company participation goalsÂ  Â 
Organized company sponsored events on campus resulting in increased brand awareness Â·Â Â Â Â 
Coached peers on the proper use of programs to improve work flow efficiency
Utilized product knowledge to successfully sell to and refer clients based on individual needs
Promoted marketing the grand opening of new branch locations to strengthen company brand affinity Â·Â Â Â Â 
Organized company sponsored events resulting in increased brand awareness and improved sales Â·Â Â Â Â 
Coached peers on the proper use of programs to increase work flow efficiency
Senior Producer - 2014 SHU Media Exchange Company Name ï¼​ City , State
Planned and executed eventÂ focusing on Connecticut's creative corridor, growth of industry and opportunities that come with development. AÂ 
panel of industry professionals addressed topics related to media and hosted a question and answer session for approximately 110 attendees.
Following the forum, guests were invited to engage in networking and conversation at a post-event reception.
Education
2014
Master of Arts : Corporate Communication & Public Relations Sacred Heart University ï¼​ City , State
2013
Bachelor of Arts : Relational Communication Western Connecticut State University ï¼​ City , State
Skills
Adobe Photoshop, ADP, Asset Management, branding, brochures, content, Customer Care, Final Cut Pro, graphics, graphic, HR, Illustrator,
InDesign, Innovation, inventory, Lotus Notes, marketing, marketing materials, marketing material, materials, Microsoft Office, SharePoint,
newsletter, presentations, process improvement, Project Management, promotional materials, publications, Quality, real-time, Recruitment,
reporting, RFP, sales, stories, Employee Development, video, web design, website, articles"
