role,experience_type,text
hr,experienced,"REGIONAL HR MANAGER
Summary
Holistic HR Professional with 5 years 7 months experience in Human Resources vertical in areas of recruitment, employee relations and
performance management after completing 2 years of full time
Experience
Regional HR Manager Aug 2015 to Dec 2016 
Company Name ï¼​ City
Looking for good HR opportunities in San Francisco Bay Area.
VISA STATUS:""Work Permit-No Visa sponsorship Required"" Skills Staffing and recruiting professional Microsoft Office Suite expert
Interviewing expertise HRIS applications proficient On Boarding/Off-boarding Report Writing Employee relations New employee
orientations Performance Management Accomplishments Recruited 250 employees in 4 months for launching new RIBG (Rural Inclusive
Banking Group) vertical of ICICI Bank.
Worked on ""Female Workforce attrition at Mid Managerial level"" and suggested ways to retain, which was incorporated in policies.
Worked on streamlining recruitment and onboarding process at indusind Bank by suggesting changes in ""E-joining"" portal.
Assisted in successful completion of project ""Applicant Experience at ICICI Bank"" which focused on enhancing recruitment experience of
applicants.
Suggestions from the project were implemented.
Worked as ""Regional HR Manager"" managing entire HR function for Andhra Pradesh/Telangana states for Assets & Liability vertical.
Led team of two HR Executives.
Role similar as HR Business Partner role since this required working closely with Business Leaders for arriving on recruitment gaps,
resolving employee escalations, and PMS related issues etc.
Handling end to end recruitment cycle right from sourcing (from job portals, through consultants and campus recruitment etc.), taking
interviews, negotiating offers till on boarding.
Ensuring every month all new joiners are included in payroll.
Maintaining new joinee tracker, induction tracker, offered applicants tracker for same.
Making monthly Recruitment Report (Power point presentation, MIS), Branch Visit report, Escalation report and taking monthly meetings
with Regional heads.
Making PowerPoint presentation for recruitment forecasting and attrition analysis on quarterly basis.
Maintaining updated HRIS for the region and sending it to business heads on monthly basis.
Handling all employee queries regarding leave request, transfers, performance appraisal.
Closing Performance Management for the financial year, liasioning with Regional Heads.
Issuing PIP (Performance Improvement Plan), Termination letters etc.
Preparing investigation reports for escalations within the region in discussion with Regional Heads.
HR Presenter in RCU investigations along with Legal and Employee Relations Manager for cases of the region.
Identifying training needs and sending employees for various training programs.Sending new joiners for induction program.
Ensuring Goal Sheet adoption, half yearly feedback is done within deadline ensuring PMS is completed on time.
Employee Relationship Manager May 2013 to Jun 2015 
Company Name ï¼​ City , State
Conducting regular branch visits for ground sensing.
Making branch visit report and maintaining branch visit tracker.
Handling employee queries regarding organization policies, transfer requests, salary and leaves etc.
Maintaining and updating HRIS for the region.Taking Induction Session of new joiners.
Handling employee grievances by analyzing case and preparing preliminary investigation report.
Conducted Performance Appraisal for Rajasthan RBG group.
Managing entire Performance Management cycle right from Goal Sheet Updation, conducting ""Half yearly feedback"", ""360 degree
feedback"", ""Normalization"" till final rating updation on People Soft.
Conducting ""Talent Panels"" for the region after ratings.
Handled PMS escalations and conducted ""Communication meetings"" for employees.
Recruitment Manager May 2011 to Apr 2013 
Company Name ï¼​ City , State
Handling Recruitment for entire Rajasthan RBG (Retail Banking Group) & RIBG (Rural Inclusive Banking Group) and GOG (Global
Operations Group).
Managing entire recruitment life cycle right from sourcing,interviewing and negotiating/releasing offers till on boarding.
Ensuring all new joiners are included in Payroll.
Making monthly Recruitment Report (both excel sheet and PPT) for monthly meetings with respective Business Heads and building
strategies accordingly.
Making annual ""Attrition report"" and ""Recruitment Forecast Report"" for entire zone.
Using ""Hirecraft"" for interview management, candidate management and maintaining pool of applicants for future requirements.
Center Head for various mass recruitment drives conducted by ICICI Bank i.e.
NIIT Leadership Program, I Bank and PO Program etc.
Campus Recruitment -Visited many campuses (MDI Gurgaon, IMT Ghaziabad, ICFAI Gurgaon IIM Kashipur etc.) for hiring MBA
freshers).
Intern Mar 2010 to Jun 2010 
Company Name ï¼​ City , State
Taking and understanding requirements from clients, sourcing applicants using ""Mass Mailing, Job Posting, doing screening and lining them
up for interviews with clients.
Coordinated & followed-up with respective HR departments for salary negotiation, joining.
Education and Training
MBA , Human Resource 2011 ICFAI Business School ï¼​ City , State , India Human Resource
Bachelor of Science , Electrical Engineering 2009 Bharati Vidyapeeth College Of Engineering ï¼​ City , State , India Electrical Engineering
Interests
Completed Diploma and trained in vocal classical music for 3 years. Won 3rd prize in national level group song competition. Captain of volleyball
team in school and presented school in various Inter school competitions. *Worked with SEEDS (an NGO) and Led 10 volunteers to organize
health & literacy awareness camps. Awarded ""Outstanding Contribution to Society"" by SEEDS acknowledging my contributions.
Skills
Banking, Closing, clients, Employee Relations, financial, forecasting, hiring, HRIS, HR, Leadership, Legal, letters, Mailing, Managerial, Managing,
MBA, meetings, excel, Microsoft Office Suite, PowerPoint, Power point, MIS, negotiating, negotiation, Payroll, People Soft, performance
appraisal, Performance Management, Performance Management, policies, Presenter, Recruitment, recruiting, Report Writing, Retail, San, Staffing,
training programs
Additional Information
Interests *Completed Diploma and trained in vocal classical music for 3 years. Won 3rd prize in national level group song competition.
Captain of volleyball team in school and presented school in various Inter school competitions. *Worked with SEEDS (an NGO) and Led
10 volunteers to organize health & literacy awareness camps. Awarded ""Outstanding Contribution to Society"" by SEEDS acknowledging
my contributions."
hr,experienced,"HR SPECIALIST
Summary
Dedicated, Driven, and Dynamic with over 20 years of customer service expertise. Motivated to maintain customer satisfaction and contribute to
company success with an emphasis in personnel and process management. Solid team player with proven ability to establish rapport with clients.Â 
Skills
Type 50 wpm and 10-Key by touch
Microsoft programs Word, Excel, Access, Outlook,
PowerPoint
Personnel management and Telephone inquiries
specialist
Excellent customer service skills with call quality and customer satisfaction as
primary focus.
Inbound and Outbound contact center experience
Excellent oral and written presentation and seasoned in conflict resolutionÂ 
Experience
Hr Specialist May 2007 to Oct 2008 
Company Name ï¼​ City , State
Accenture Peopleline Email Management Team.
Received inbound emails from clients as initial point of contact to answer questions related to HR policies, practices or to resolve issues.
Helped the client by answering their inquiry, resolving their issue or routing their email to a caseworker for resolution.
Recorded and tracked the client issue via the case management tool from initiation to resolution.
Maintained records of customer interactions and transactions by documenting details of inquiries, complaints, and comments as well as
actions taken.
Customer Service Representative Mar 2007 to Feb 2008 
Company Name ï¼​ City , State
Maintained records of customer interactions and transactions by documenting details of inquiries, complaints, and comments, as well as
actions taken.
Developed and implemented filing and delivery methods for FMLA and Short Term Disability documentation to respective global clientele.
Facilitated communication for the Absence Management Team to clients and internal departmental teams.
Organized and maintained payroll and people services database management system.
Communicated to clients and internal/external departmental teams mitigated risks and resolutions regarding policy, transactions and other
queries
Call Centre Shift Supervisor Aug 2003 to Mar 2007 
Company Name ï¼​ City , State Answered and Dispatched calls for Medical and Professional clients in the San Antonio and surrounding areas.
Provided call monitoring to ensure staff was adhering to quality call control. Maintained On Call books for various medical staff to ensure that the
correct staff was contacted during after hours and weekends.Â 
Education and Training
Certificate of Completion *Business Administration 1997 Texas A&M Extension Services ï¼​ City , State
Skills
10-Key by touch, Type 50 wpm, filing, Access, Â Microsoft Excel, Microsoft Outlook, Microsoft PowerPoint, Microsoft Word"
hr,experienced,"HR ANALYST
Summary
Experienced professional with background in Human Resources, Administrative, and Customer Service environments. Proficient in MS Excel,
Word, Power Point, Share Point, Taleo, Autonomy, One Note, SAP, Visio, OrgPlus, and Outlook. Able to effectively manage project tasks and
implement processes to support immediate and long-term objectives.
Accomplishments
Lead HR team through successful clean-up, categorization, and electronic conversion of over 3,500 employee files.
Experience
Company Name October 2012 to July 2015 HR Analyst 
Provide Human Resources and Employee Relations transactional service assistance to managers and employees throughout Kraft Foods.
Work to ensure process integration is supported within HR function during Kraft Merger by adapting to, and executing revised HR
methods.
Serve as lead for Workforce Solutions Intake group, providing guidance on HR task questions, overseeing Intake scheduling, defining
current processes and implementing new processes to increase productivity.
Oversee Share Point site updates, ensure systems are operational in accordance with Intake needs. Serve as point of contact for IS and
technical concerns.
Lead Intake team through successful clean-up, categorization, and scanning of over 3,500 employee files.
Implement and maintain processes for the addition of employee documentation through Autonomy systems database.
Support Sr. HR Director by monitoring, collecting and analyzing manager transaction requests and employee relation case data by utilizing
SharePoint database and Excel functions, providing reports on a quarterly basis.
Serve as main point of contact for Kraft Foods Scholarship program. Continuously reviewed process to improve management of
scholarship program. Collaborated with third party to administer enhancing scholarship applications, FAQ updates, scholarship selection
guidelines and policy clarification.
Project involvement including on-boarding improvement, New York wage letter distribution, and severance support.
Company Name January 2012 to October 2012 HR Coordinator 
Support Workforce Solutions group with collection and distribution of company-wide organization announcements and other administrative
tasks.
Consult with managers/employees to determine the type of HR transaction(s) needed, including but not limited to policy questions, employee
relation issues, terminations, new hire process, and compensation changes.
Serve as main point of contact for Illinois unemployment office to assist with claim management / distribution and data verification for U.S.
employees.
Support severance process by creating employee specific disability letters and assisting with severance packages, including the preparation
and creation of severance exhibits.
Generate ad hoc reports utilizing SAP system.
Company Name February 2008 to January 2012 Senior HR Coordinator Sales 
Manage schedules, travel, and meeting preparation or Area VP Sales.
Created Sales Newsletter, summarizing relevant updates and current information, promoting steady communication within sales group.
Analyze yearly goal progress for employees utilizing Gallup Survey Systems.
Utilize Taleo applicant tracking system, handle On-Boarding for the Chicago and Kansas City Customer Logistics Group including but not
limited to background checks, phone screens and drug testing.
Distribute Unemployment Claims for manager response and completed all unemployment verification specifics for U.S. employees.
Developed and implemented improved monthly HR reports based on the needs of the HR partners which include the following: Employee
rosters, Open Positions, PT and FT hours worked STD, New Hires, Promotions, Demotions, Terminations, Risk Management, and
educational information.
Submit HR Online transaction requests including promotions, terminations, Return to Work & Job Changes, ensuring timely transaction
completion.
Confirm successful processing and payout to sales employees for vacation relief program.
Maintain payables for all Background/Verifications charges to clients.
Company Name September 2007 to February 2008 Administrative Assistant 
Maintain and update Team Sites for Central Area retail accounts, Outlook distribution lists, and sales samples manifest.
Run allocation reports and Incentive Contest update reports, distributing to sales teams weekly.
Format and post quarterly sales priorities decks, utilizing Power Point. Retrieve, zip & post all customer business team weekly updates.
Post files for customer business teams used in monthly mailings. Send reminder notifications to all managers responsible for monthly sales
priority distribution. Assist Retail Leads to ensure sales priority data collected and posted in a timely manner.
Planned and organized materials for sales meetings, complete A/P for Service Center, Retail and all other miscellaneous office functions.
Education
University of Phoenix 2012 Bachelor : Psychology
Skills
Systems: Excel, Outlook, Power Point, Visio, One Note, Share Point, SAP, Advise HR, Siebel, TALX, Autonomy, Survey Monkey, Taleo
Training: Prosci Change Management Certification (2015), Herrmann Brain Dominance Instrument (2014), Interview Skills Selection and
Development (2014)"
hr,experienced,"HR GENERALIST/RECRUITER
Summary
Human Resource Generalist who is an great communicator and negotiator with strong conflict resolution skills. Extensive background in recruitment
and retention, mediation and records management.
Highlights
ADP, People fluent, Microsoft Offices, Interviewing expertise
Performance management strategies
Benefits administrator
Employee relations
Benefits administrator
Manager coaching and training
HRIS applications proficient
Payroll expertise
National Human Resources Association
Event management
Employee handbook development
QuickBooks proficiency
Alternative Dispute Resolution (ADR)
Staffing and recruiting professional
Accomplishments
Led the Staffing Planning Committee for [Number] years.Introduced the first passive Open Enrollment process.Human Resources
Reduced employee turnover by 10%.
Experience
HR Generalist/Recruiter 
January 2013 to January 2015 Company Name ï¼​ City , State
January 2013 to January 2014
Strategize with management on all recruitment needs (over departments) Build strong relationships with candidates, hiring managers to
ensure a high level of customer service.
Keep hiring managers informed throughout the recruitment process for all salaried and non-salaried employees.
Co-authored all recruitment & transfers process to better the onboarding and applicant experience Maintained an accurate and detailed
record of each employee in a customized database for all pre-employment screening Interpret company policies and procedures to new
hires Provided mentoring and job coaching for temporary and permanent employees Negotiate/ analyzed compensation and make
recommendations for salaried and non-salaried employees Create metric reports for HR director as well as staffing reports for Clinical
Associate Director Coach and advise employees regarding HR programs, practices and procedures Plan, manage and communicate special
projects and programs such as employee recognition, wellness, benefits, recruiting and performance management, and employee surveys
Resolves employee concerns related to health and welfare plans functioning as liaison with various insurance carriers Collaboratively efforts
with Training and IT department to train and orientate all new hires within the organization.
Human Resource Administrator 
January 2006 to January 2012 Company Name ï¼​ City , State
Managed the recruitment applicant tracking system (moved candidates to appropriate workflow, creating and closing job posting) Managed
all new hire onboarding, coordinating and/or conducting new hire orientation and ensure all paperwork were 100% in compliance with
federal and state regulations Provided recruitment metrics reports and compile reports from HRIS database for the HR Business Partner
Assisted in administering and adhering to existing policies and procedures (e.g., Employee Handbook and Policies and Procedures
manuals), by providing training, mentoring and coaching Managed annual employee benefits open enrollment (coordinated logistics with
benefit vendors such as; Aetna, Harford, Vanguard) for all sites throughout the US Created HR processes for HR Business Partner
(temporary staffing, tuition reimbursement, full cycle recruitment) Involved in the annual performance management process including merit
increases (tracked/monitored, rewrite job descriptions, ensure appropriate approval flow or make changes) Maintained relationships with
staffing vendors for temporary employees Point of contact for 1000+ US based employees regarding benefits, policies and procedures.
Assisted in resolving personnel-related problems Addressed employee relation concerns and exit interviews Responsible for all leave
administration, including FMLA and discretionary leave tracking and notifications, coordination with paid time off, disability programs,
and/or health benefits, as well as return to work protocols.
Assistant Store Manager 
January 2005 to January 2006 Company Name ï¼​ State
Managed exempt and nonexempt employees (6-8 staff members) Contributed to team effort by accomplishing related results as needed
Helped customers by providing information, answering questions and obtaining merchandise requested Attracted customers by originating
display ideas Constructed or assembled prefabricated display properties Assembled product displays in windows and showcased on sales
floor Evaluated competition by visiting local competitor stores (gathering information such as style, quality, and prices of competitive
merchandise).
Education
Masters of Administrative Science : June 2013 Fairleigh Dickinson University ï¼​ City , State
B.S : Economic , 2005 Economic
A.A : Liberal Arts , 2002 Liberal Arts
Skills
ADP, benefits, closing, Coach, coaching, competitive, customer service, database, hiring, HRIS, HR, insurance, logistics, Director, mentoring,
windows, performance management, personnel, Policies, processes, protocols, quality, recruiting, recruitment, sales, staffing, workflow"
hr,experienced,"HR DIRECTOR
Summary
HR Professional offering over 15 years of progressive experience including extensive practice in multi-unit businesses (in and out of state
locations). Highly driven to achieve company goals. Expertise in developing and implementing HR plans and procedures smoothly and with little
guidance. Strong conflict resolution skills. Comfortable with taking the lead in employment protocol compliance and in anticipating staffing needs.
Highlights
Employment law knowledge
Benefits administrator
Manager coaching and training
HRIS applications proficient
Employee relations
Staffing and recruiting professional
Off-boarding
Employee handbook development
Experience
November 2007 to October 2014
Company Name City , State HR Director
Plan, organize and implement all facets of HR for New Kent horse track and 8 off track betting sites throughout the Commonwealth,
approximately 650 employees (250 permanent and 400 seasonal)
Review federal and state laws to confirm and enforce company compliance.
Provide employee relations guidance and counsel to all levels of management; conduct investigations as needed
Worked with senior-level management to create fair and consistent HR policies and procedures
Assessed employee performance and issued disciplinary notices
Created and modified job descriptions within all departments in compliance with FLSA
Coordinate and manage Family Medical Leave (FMLA), Short/Long Term Disability (STD/LTD)
Evaluate and maintain Worker's Compensation claims; annual WC and OSHA reporting
Represent Company for unemployment, EEOC and other related hearings
Conduct benefits administration for 125 benefit-eligible employees, including reconciliation and payment monthly
Recruitment and hiring of seasonal employees, including new hire orientations
Maintain HRIS (ADP Enterprise) and employee files
Partner with upper management on all reduction of workforce action and severance packages.
Manage all in-kind donations made by the Company as well as coordinating our volunteer work with the New Kent Food Pantry.
October 2004 to March 2008
Company Name City , State HR Generalist
for assigned station, division, and corporate personnel of 30 TV stations and 1 communications company across the Southeast,
approximately 2,000 employees Manage FMLA, STD, LTD, and Worker's Comp for division Maintain division job requisition database;
provide recruitment/retention support to the field Ensure EEO Broad Outreach is maintained Performance management planning and
implementation Organize and train field HR for annual benefits open enrollment Design and deliver monthly reports for division HR Director
and Corporate HR Vice President Provide employee relations counseling and investigations Participate on the wellness committee,
Community Outreach, and Employee Engagement Coordinate and deliver annual HR conference with corporate HR team.
January 2004 to October 2004
Company Name Benefits Administrator
Administer benefit plans for 27 newspapers and TV stations, approximately 3,500 employees Process enrollments daily using PeopleSoft
8.0 Assist corporate and field HR personnel regarding benefits issues/questions Assist Benefits Director in planning and implementation of
annual Open Enrollment Ensure all rules and regulations pertaining to the company's benefit plans, including HIPAA are followed.
February 2001 to January 2004
Company Name City , State HR Coordinator
HR for 4 daily and 2 weekly newspapers, approximately 400 employees.
Report payroll biweekly using Simplex/Winstar timekeeping system Recruit for open positions; Manage onboarding Provide assistance to
employees and managers regarding policies and processes Organize and conduct annual open enrollment for benefits; consult employees on
all benefit programs and general procedures Design and deliver weekly and monthly HR and payroll reports for upper management;
Maintain PeopleSoft HRMS database and personnel files Reply to employment/wage verifications for employees; conduct exit interviews;
handle unemployment claims; complete annual wage surveys Administer and maintain COBRA, STD, LTD and WC files in addition to
OSHA reporting Conduct annual anti-harassment and safety training.
Education
Newberry College 
City , State Mathematics Computer Science Mathematics Computer Science
Batesburg Leesville High School 
City , State H.S. Diploma GPA: GPA: 3.5 Honor graduate GPA: 3.5 Honor graduate
Skills
ADP, Benefits, counseling, database, employee relations, hiring, HRIS, HR, Director, meetings, Enterprise, newspapers, payroll, PeopleSoft 8.0,
PeopleSoft HRMS, Performance management, personnel, policies, processes, Recruitment, reporting, safety, TV
Professional Affiliations
Professional Human Resources (PHR) - Human Resources Institute, 2006 - current Member: Society of Human Resources Management and
Richmond Society of Human Resources Management Member: Reid Institute"
