role,experience_type,text
hr,experienced,"HR CONSULTANT
Summary
Certified Human Resources Professional with 15 years background in full range of HR functions with extensive experience in employee
management, hiring, training State and Federal compliance and the ability to incorporate HR practices to achieve business results.
Highlights
Training and development
Recruiting
Exceptional interpersonal skills
Manager coaching and training
Performance management
Employment law compliance
Employee relations
Accomplishments
Established HR infrastructure as companies transitioned from small to mid-size.
Trained HR staff in proper creation and retention of HR documentation
Instituted Performance Management process with supporting training and follow-up.
Supported Company through change management during and after acquisition.
Implemented process for leave management incorporating the complex interaction of FMLA, CFRA, ADAAA and PDL.
Experience
HR Consultant 
July 2014 to December 2014 Company Name ï¼​ City , State
Partnered with legal department of multi-state client (40,000+ employees) to establish ADAAA and other workplace compliance. Identified and
updated a backlog of LOA and accommodation issues.
Human Resource Specialist 
August 2008 to June 2014 Company Name ï¼​ City , State
Human resources advisor to a diverse group of clients from various industries, delivering customized HR service solutions that positively
impact client business and ensure compliance with State and Federal laws.
Reviewed federal and state laws to confirm and enforce company compliance.Designed the employee performance evaluation process and
merit program.Created and implemented the exit and interview program process.Advised top management on appropriate employee
corrective actions.Created and modified job descriptions within all departments.Worked with senior-level management to create fair and
consistent HR policies and procedures.Worked with HR advisors and HR representatives on establishing consistent hiring practices.Created
and managed more than [Number] confidential personnel records.Guided clients on how to conduct background checks and verify
references.Developed more than [Number] employee handbooks, including design and layout.Facilitated monthly meetings to develop
strategies that would positively influence workplace relationships.Conducted an average of [Number] employee exit interviews per
year.Processed all salary changes stemming from merit increases, promotions, bonuses and pay adjustments.Processed all salary changes
stemming from merit increases, promotions, bonuses and pay adjustments.Guided the startup and management of all HR operations,
systems and programs for a new location within the company.Led a weekly open enrollment question and answer session with employees
on benefit program updates.Supported [Number] employees at all levels, including executive leadership.Recruited and interviewed
[Number] applicants per [Time period].Increased the employee base by [Number]% to meet changing staffing needs.Implemented an
innovative employee incentive program, which resulted in a [Number]% increase in staff productivity.Directed [Initiative] to maximize
[Positive outcome].Answered employee questions regarding [Topic] and [Topic] and resolved any issues.Advised managers on
organizational policy matters and recommend needed changes.Conducted new employee orientation to foster positive attitude toward
organizational objectives.Directed personnel, training and labor relations activities.Identified staff vacancies and recruited, interviewed and
selected applicants.Served as a link between management and employees by handling questions, interpreting and administering contracts
and helping resolve work-related problems.
Worked directly with small business owners and start-up companies to build, redefine and update HR department to support organization's
strategic goals and objectives. Provided liability management training to supervisors and managers. Created and implemented interview and
selection, performance management, succession planning processes. Utilized HR Metrics to support creative solutions for Human Capital
Management.
Provide guidance on compliance as well as design programs to attract, retain and grow staff.
Manage ER matters to provide conflict resolution and mitigate liability.
Human Resource Generalist 
April 2007 to April 2008 Company Name ï¼​ City , State
Partnered with managers to interpret and implement company policy, providing insight and guidance on employment law in order to maintain
consistency and compliance. Provided coaching and counsel in the areas of employee relations, performance management and corrective
actions. Acted as liaison between managers, employees and centralized HR functions during implementation of organizational process
changes. Identified issues and proposed changes that challenge the status quo to align growth with corporate goals. Considered SME
(subject matter expert) for Leaves of Absences, Workers Compensation and I-9 compliance. ""Go-to"" person for HR staff.
Created and implemented processes for rectification of compliance issues.
Worked closely with corporate benefits in order to implement new leave process.
Developed materials to guide employees through newly implemented processes.
Human Resources Coordinator 
January 2003 to January 2007 Company Name ï¼​ City , State
Partnered with managers and supervisors in order to provide HR support for 3 sites in Southern California, with over 600 employees.
Managed all LOA including FMLA, CFRA and PDL to ensure compliance with State and Federal regulations and company policies.
Provide coaching and counseling in the areas of compliance, employee relations, disciplinary actions and review process.
Worked closely with the VP and legal department to respond to EDD, FEHA and company hotline complaints. Successfully avoided
litigation by consistent practice and clear documentation.
Conducted investigations, documented and determined appropriate resolution.
Proactively determined training needs and created programs to develop workforce for anticipated technology, reducing staff turnover,
increasing productivity and quality.
Developed screening matrix for government funded training program resulting in 100% successful completion and overall improvement in
workforce.
Supported Distribution center with all HR related needs during automation, including change management and department restructure and
compensation structure.
Working member of implementation team for Oracle HR.
Provided staffing and recruiting support for positions ranging from hourly to technical specialties.
Conducted market analysis using compensation surveys to ensure equity for employees.
Calculated quarterly and annual bonuses per multiple national and international programs.
Maintained training record to comply with ISO9001 audits.
Resolved employee issues with payroll and Benefits.
Conducted New Hire orientation, Sexual Harassment Prevention and other training as required.
Administered review process for non-exempt and exempt employees.
Evaluated, selected and built relations with vendors resulting in 50% reduced cost and better service. Provided support for HR department
and coordinate all on-site and off-site events. Interacted with workers' compensation and medical facilities to facilitate claims resolution.
Maintained FMLA and WC documents and logs. Worked closely with VP of HR on matters ranging from creation of new awards program
to facility closures. Compiled and filed OSHA and AQMD reports per requirements.
Administrative Assistant 
January 2000 to January 2001 Company Name ï¼​ City , State Provided general support for the HR department and director of HR. Responsible
for all company events, recreation programs, answering general benefits inquiries and ensuring completion of all paperwork.
Education
B.S. : Pharmacology University of Dundee
B.S., Pharmacology, University of Dundee, Scotland
Certifications
PHR , GPHR
SHRM-SCP - Senior Certified Professional
Professional Affiliations
Society of Human Resources Managers (SHRM) and PIHRA
Skills"
hr,experienced,"HR & SAFETY MANAGER
Summary
Human Resources Manager Certified Professional in Human Resources (PHR) Extensive background in human resources management, including
experience in workforce planning and employment, human resource development, compensation and benefits, risk management, employee and
labor relations, HR technology, global and international HR, talent management. Demonstrated success in negotiating win-win situations, strategic
business management, talent management, and change management. HR Skills HR Strategic Planning Training & Development Performance
Management Organizational Development Mediation & Advocacy Staff Recruitment & Retention Employee Relations Alternative Dispute
Resolution (ADR) Benefits Administration Project Management Orientation & On-Boarding HR Policies & Procedures Employment Law
FMLA/ADA/EEO/WC HRIS Technologies
Experience
HR & Safety Manager 
January 2013 to January 2014 Company Name ï¼​ City , State
Rapidly growing transportation, distribution, and warehousing company Serving the HR and safety needs of the organizations' various
operations, while leading the change management and cultural transformation efforts to support continued growth and expansion.
Key Results: Consolidated two small group medical plans with different plan years into a large group plan to maintain the same quality of
health plan while saving the organization 75% on the year-over-year premium increase.
Improved the benefit offerings by adding never before offered dental insurance, voluntary term-life insurance, a vision discount program,
employee assistance program (EAP); while expanding the available short-term disability and accident insurance to all of the organizations'
associates.
Streamlined the unemployment and Ohio Bureau of Worker's Compensation (BWC) systems to create consistency and reduce costs.
Site Supervisor (HR Generalist) 
January 2011 to January 2013 Company Name ï¼​ City , State
Providing HR support for the operations management team of the company's second largest revenue producing account, while also assisting
the organization's staffing firm, and championing special projects for the HR department.
Key Results:.
Collaborated with the operations management team to recruit, train, and develop a high-performance work team to improve productivity by
70% and reduce turnover by 50% year-to-year, which helped to earn the account the recognition as ""Most Improved Account"".
Led the development of a new performance evaluation form and process to improve the processing, tracking, and administration of annual
performance reviews and performance management.
Senior Bill Pay Support Associate 
January 2008 to January 2011 Company Name ï¼​ State
Commissioned Officer (NCO) 
January 1997 to January 2006 Company Name
Served in various positions and locations throughout military career.
Developed human resources responsibilities, including mentoring and counseling personnel, conducting medical and basic skills training and
education, managing staff scheduling, and coordinating and documenting treatment.
Within scope of this responsibility, also directed the personnel operations of 1,000-person medical company, including file documentation,
plan monitoring, and processing and training and development documentation.
Progressively assumed increasing levels of responsibilities, positions, and earned promotions ahead of peers.
Key Results: Utilized Microsoft Access to automate previously manual documentation processing system for 1,000-person company,
resulting in elimination of lost documents, communication breakdown and improved tracking of personnel activity.
Served as unit Joint Commission and Accreditation of Healthcare Organization inspector and committee representative for an organization
earning difficult-to-achieve 100% score on accreditation and maintaining it under 2-year tenure.
Adapted formal standard operating procedures (SOP) through use of job and task analysis techniques; implemented resulting changes to
enable flexibility within diverse environment, resulting in a 30-40% improvement rate and increased operational productivity.
Received multiple medals of recognition from U.S.
Army including: 3 Commendation Medals, 2 Army Achievement Medals, 1 Good Conduct Medal and various other decorations.
Awarded Noncommissioned Officer of the Quarter, 109th Medical Battalion, Third Quarter 2003.
Education
Master of Science (MS) : Human Resource Management , 2016 Keller Graduate school of Management, Devry University ï¼​ City , State Human
Resource Management
Bachelor of Science (BS) : Human Resource Management Franklin University ï¼​ City , State Human Resource Management Worked
concurrently during college as a Medical Assistant/Phlebotomist and Bill Pay Support Associate. Of Note"
hr,experienced,"HR INTERN
Summary
An enthusiastic student, highly motivated and committed to developing personally and professionally. Have the ability to learn quickly, work
efficiently and use my educational knowledge effectively in work settings. Skilled in research, multi-tasking, time management and communication.
Experienced in human resource / organisational management, counselling and business development.Â 
Educational Background
Master of Arts , Organisational Psychology 2018 Alliant International University ï¼​ City , State , United States California School of
Professional Psychology
Master of Science , Counselling Psychology 2015 Avinashilingam Institute for Home Science and Higher Education for Women ï¼​ City , State ,
India GPA - 3.63Â 
Bachelor of Arts , Mass Communication 2013 Amrita Viswa Vidhyapeetham ï¼​ City , State , India
Amrita School of Communication
GPA - 3.07Â 
Experience
HR Intern Jul 2016 to Current 
Company Name ï¼​ City , State
I get candidates moved through the hiring process, making sure that they are properly credentialed and meet all of the company's and the clients
requirements. Â  Â 
Basic background checks Â  Â  Â  Â  Â  Â  Â  Â  Â  Â 
Contact candidate's references & collect necessary information
License and employment verification -Reviewing/uploading credentialsÂ 
Pre-screen applicants from job boards (Indeed & Zip Recruiter)
Make and send badges
Attend/transfer calls, take messages
Work independently and as part of a team to achieve the company's goals.
Bookstore Volunteer Feb 2016 to Jul 2016 
Company Name ï¼​ City , State
Opening the store
Account and check the closing and opening balance
Maintain complete and accurate records of the store's transactions
Rearrange books to maintain a neat and tidy reading area
Assessed customer needs and responded to questions
Assistant to the General Manager Apr 2015 to Nov 2015 
Company Name ï¼​ City , State
Managed the day-to-day tactical and long-term strategic activities within the business.
Reviewed and approved billing invoices and expense reports.
Counselled and mentored 53 staff members by offering constructive feedback, stress management techniques and guidance.
Traveled with the manager to take notes and prepare minutes at meetings.
Screened telephone calls and inquiries and directed them as appropriate.
Maintained and recorded financial accounts of daily sales, purchases and other expenses.Â 
Student Intern Jan 2015 to Feb 2015 
Company Name ï¼​ City , State
Administrative Assistance.
Conducted & scored tests (16PF, Stress Inventories) to new clients and as follow-ups.
Established rapport, collected & organised new client data.
Administered ""Positive Therapy"" to patients.
Assisted with rehabilitation activities.
Individual, Family & Matrimonial Well Being/Therapy, Educational counselling, De- addiction / Smoking cessation and suicide
prevention.Â 
Intern Dec 2014 to Jan 2015 
Company Name ï¼​ City , State
Assistance and guidance to families below poverty line.
Counselling individuals with issues relating to family, marital, legal issues.
Provided sex education, awareness about good/ bad touch to young school students.
Observed the counselling sessions provided to sex workers.Â 
Summer Intern May 2014 to Jun 2014 
Company Name ï¼​ City , State
The internship program was systematically split to accommodate sufficient training in De-addiction centre, Special school for mentally
challenged children, Psychiatric clinic for adults and counselling centre.
Witnessed and assisted with an ECT session administered by the Chief Doctors.
Collected information about clients, using techniques such as testing, interviewing, discussion, and observation.
Gathered feedback from patients on medications, diagnosis and effectiveness of therapies.
Gained knowledge and experience observing doctors provide counselling to patients and families.Â 
Skills
Microsoft Excel, Outlook, PowerPoint, Word.Â 
Excellent communication Skills
Organisational Skills
SPSS
Data Entry
Researches
Autosuggestion as a mediator in weight management in female college students. Master's Thesis. (M.Sc, 2014-15)Â 
Sample: 82 female college students, convenient sampling method. The selection of the 82 participants were based on the Inclusion and
Exclusion Criteria.
The participants selected were assessed for their anthropometric data and they also completed WHO (Five) Well- Being Index. Group A
(Exercise Diet Autosuggestion) and Group B ( Exercise Diet ).
Results: A marginal but not a statistically significant difference in the body weight of the participants in both Group A and Group B. There
was a statistically significant difference in the well-being of the participants in both Group A and Group B.Â 
Mindfulness and Burnout of Teachers in StateBoard and Matriculation schools (Demographic factors). Master's Project. (M.Sc,
2014)
Sample: 150 (51 Female and 24 Male in State board)(58 Female and 17 Male in matriculation)
Scales : Mindfulness Attention Awareness scale and Burnout Inventory.
The data were analysed by standard statistical tools such as karl pearson co- efficient of correlation, analysis of variance and t-test.
Result: There were no statistically significant relationship between Mindfulness and Burnout in both Matriculation and State board schools.Â 
Relation between Indian Zodiac and Personality types(MBTI). Master's Project. (M.Sc, 2015)
Sample: 100 samples (Female 52 & Male 48) , were randomly selected.
The Myers Briggs Type Indicator (MBTI) was administered and scored.
The results showed that there was no significant relation between the two variables.
The sample size cannot determine the relationship, further studies can be done to conclude or disprove the findings of the current study.Â 
Publications
Snega Prabha S. A writer in the Mind. SPEAR (Sawyerpuram Pope's Emerging Aspirants In Research). Volume: II, No : 2. ISSN:2319-
1902. July-December 2013.
Dr. Preetha Menon, Snega Prabha S. Autosuggestion as a Mediator in Weight Management in Female College Students.
International Journal of Scientific Research, Vol: 4, Issue: 7 July 2015.Â 
Certifications
Foundation Course on Education of Children with Learning Disabilities, Certified by Rehabilitation Council of India. (2014)
TA-101. Introduction to Transactional Analysis. (2015)
Hypnotism and it's Application in practice. (2015)
Bio Ethics in Research. (2014)Â 
Affiliations
APA - American Psychological Association (2016)
AffiliateÂ 
Volunteer Activities
San Diego Humane Society - San Diego, CA (June 2016 - Present)
Humane Animal Society - India Â (Aug 2014 - Nov 2015)
Puppy Palace - India (Aug 2014 - Nov 2015)
â€‹"
hr,experienced,"HR SPECIALIST
Highlights
Staffing and recruiting professional
Interviewing expertise
Recruiting
Personnel records maintenance
Affirmative Action compliance
Fluent in [Language]
Detail-oriented
Microsoft Office Suite expert
People-oriented
Experience
07/2015 to Current
HR Specialist Company Name ï¼​ City , State
Assisted with the establishment of the hiring process that is currently in use at the George's Employment and Training Center.
Assisted in the creation and implementation the first electronic hiring process within George's that pre-printed a new hire's SSN, address,
the date and name which decreased the time to hire someone from 1 hour to 30 minutes, on average.
Assisted with the development of the first electronic application for production hiring.
Explain terms of position with new hires, such as salary, hours, dress code, job description, etc.
Responsible for onboarding new employees, which includes administering new, hire paperwork, E-Verify, and I-9 Verification.
Establish and maintain relationships with HR managers to stay abreast of current and future hiring.
Coordinated driver-recruiting process.
10/2010 to 07/2015
HR Specialist Company Name ï¼​ City , State
Assisted the Managers in the staffing and compliance for 16 area locations.
Staff, insure compliance training is completed, track their assignments, evaluations, system access and terminations in the Tyson clerical and
industrial temp pool, which is over 100 people as direct reports.
Assisted with the development and piloted the first electronic application for production hiring.
Collaborated with Team to develop a detailed processes for non-discretionary, discretionary, and professional hiring.
Reviewed every I-9 and E-Verify for errors.
Ran and completed E-Verify on new hires.
Knowledgeable in SAP, ADHOC, Training and Events and e-Recruitment data entry and Reporting.
03/2009 to 10/2010
HR/Benefits Clerk Company Name ï¼​ City , State
Analyzed employment-related data and prepared required reports.
Developed reports on employee headcount, monthly HR reports and quarterly training reports.
Managed all aspects of the employee life cycle process, including on and off boarding.
Communicated the duties, compensation, benefits and working conditions to all new hires.
Ensure new hire files were complete and accurate.
Worked extensively in SAP and verified all data entered was accurate.
Explained human resources policies and procedures to all employees.
Conducted telephone and onsite exit interviews for all employees.
Worked on 401(k) administration, FMLA and all areas of insurance and benefits.
Generated employee-tracking reports each month.
Managed communication regarding employee orientation and open enrollment for Benefits.
Ensured enrollment of all new hires into Tyson's insurance plans.
08/2007 to 03/2009
HR Clerk Company Name ï¼​ City , State
Maintained open position postings.
Maintained customer service focus with employees and applicants at all levels of the organization.
Verified applicant references and employment history.
Experienced with multiple line telephones, handling routine inquires, directing calls and taking messages.
Distributed appropriate employment documentation to various plant locations.
Maintained accurate information on outgoing files to all locations.
Entering initial data, prepare for hire and rejecting in SAP as well as making any necessary changes from the recruitment side of SAP.
Generating reports.
Verify that applications are complete.
Provide assistance to applicants in completing the application.
Translate in Spanish when necessary.
Ensured all compliance laws were followed.
10/2006 to 03/2007
Receptionist Company Name ï¼​ City , State
Managed the receptionist area, including greeting visitors and responding to telephone and in-person requests for information.
Maintained the front desk and reception area in a neat and organized fashion.
Served as central point of contact for all outside vendors needing to gain access to the building.
Made copies, sent faxes and handled all incoming and outgoing correspondence.
Posted open positions in the lobby and with Workforce.
Worked with a very diverse labor pool.
Ensure all applications were completed to compliance standards.
Explained the application process to applicants.
Scheduled interviews and the on-boarding process.
09/2005 to 10/2006
Administrative Assistant Company Name ï¼​ City , State
Greet and receive visitors.
Answered heavy phone traffic.
Maintained inventory of office supplies.
Coordinated CPR classes for customers and staff.
Assisted staff in coordinating meetings and telephone conferences.
Education
2001
Diploma Rogers High School
Skills
Benefits, central point of contact, clerical, conferences, CPR, customer service, data entry, directing, documentation, fashion, faxes, focus, hiring,
human resources, HR, insurance, inventory, meetings, access, office, neat, policies, processes, receptionist, reception, Recruitment, recruiting,
Reporting, SAP, Spanish, staffing, taking messages, telephone, telephones, phone, Type"
